{"type":"relaymark.manifest","version":1,"actions":[],"mentions":[],"references":[],"forms":[],"sources":[],"claims":[],"comparisons":[],"property_sheets":[{"block_id":"b2","binding":"paper.person.properties","fields":["full_name","emails","phones","company"],"title":"Contact","presentation":"stack"}],"data_views":[{"block_id":"b5","source":"paper.related_commitments","projection":"table","columns":["name","status","due_at"],"sort":["due_at"],"limit":20,"title":"Commitments"},{"block_id":"b7","source":"paper.journey_summary","projection":"chart","columns":["stage","count"],"filter":{"window":"90d"},"sort":["stage"],"title":"Journey pattern"}],"capabilities":[{"block_id":"b2","id":"binding.property_sheet","fallback":"summary"},{"block_id":"b5","id":"binding.data_view","fallback":"summary"},{"block_id":"b7","id":"binding.data_view","fallback":"summary"}],"diagnostics":[]}
