{"type":"relaymark.manifest","version":1,"actions":[],"mentions":[],"references":[],"forms":[],"sources":[],"claims":[],"comparisons":[],"entity_references":[{"block_id":"b2","id":"entity:person-jordan","label":"Jordan Lee","projection":"card"}],"data_views":[{"block_id":"b4","source":"paper.related_commitments","projection":"table","columns":["name","status"],"sort":["name"],"title":"Commitments"}],"layouts":[{"block_id":"b1","mode":"adaptive_columns","columns":2,"label":"Person overview"}],"capabilities":[{"block_id":"b1","id":"layout.adaptive_columns","fallback":"children"},{"block_id":"b2","id":"entity.reference","fallback":"plain_text"},{"block_id":"b4","id":"binding.data_view","fallback":"summary"}],"diagnostics":[]}
